{
  "schema_version": "1.0",
  "adventure_id": "FIXTURE_WF_SCENE_CONTRADICTS",
  "fixed_truth": {
    "culprit_id": "NPC-A",
    "motive": "money",
    "method": "push",
    "opportunity": "basement",
    "immutable_facts": [{ "fact_id": "FACT-001", "statement": "Victim died" }]
  },
  "causal_timeline": {
    "events": [
      {
        "event_id": "EVT-001",
        "timestamp": "2024-03-15T19:35:00",
        "day_label": "Day 1",
        "location_id": "LOC-BASEMENT",
        "participants": ["NPC-A"],
        "causes": [],
        "effects": ["FACT-001"]
      }
    ]
  },
  "world_state_timeline": {
    "snapshots": [{ "at_event_id": "EVT-001", "people_locations": { "NPC-A": "LOC-BASEMENT" } }]
  },
  "npc_knowledge": { "npcs": [] },
  "evidence_provenance": { "evidence": [] },
  "observable_information": {
    "observations": [
      { "observation_id": "OBS-001", "learnable_fact_id": "FACT-001", "requires": { "action": "observe" } }
    ]
  },
  "conclusion_requirements": {
    "questions": [{ "question_id": "Q-CULPRIT", "answer_entity_id": "NPC-A", "required_fact_ids": ["FACT-001"] }]
  },
  "narrative_construction": {
    "scenes": [
      {
        "scene_id": "J-100",
        "asserted_culprit_id": "NPC-B",
        "asserted_fact_ids": ["FACT-INVENTED"],
        "player_text_summary": "Scene invents truth"
      }
    ]
  }
}
