{
  "schema_version": "1.0",
  "adventure_id": "FIXTURE_ENV_VALID",
  "causal_timeline": {
    "events": [
      {
        "event_id": "EVT-001",
        "timestamp": "2024-03-15T19:00:00",
        "day_label": "Day 1",
        "location_id": "LOC-LOBBY",
        "participants": ["NPC-A"],
        "causes": [],
        "effects": []
      },
      {
        "event_id": "EVT-002",
        "timestamp": "2024-03-15T19:35:00",
        "day_label": "Day 1",
        "location_id": "LOC-BASEMENT",
        "participants": ["NPC-A"],
        "causes": [],
        "effects": []
      }
    ]
  },
  "world_state_timeline": { "snapshots": [] },
  "fixed_truth": {
    "culprit_id": "NPC-A",
    "motive": "x",
    "method": "x",
    "opportunity": "x",
    "immutable_facts": [{ "fact_id": "FACT-001", "statement": "x" }]
  },
  "npc_knowledge": { "npcs": [] },
  "evidence_provenance": { "evidence": [] },
  "observable_information": { "observations": [] },
  "conclusion_requirements": { "questions": [{ "question_id": "Q1", "required_fact_ids": ["FACT-001"] }] }
}
